source_id,gt_line,gt_text,moss_clone,voxcpm_clone,reference_audio
289,18,"تستطيع الطريقة المقترحة في هذا البحث التعامل مع النصوص العربية المشكلة وغير المشكلة وتنتج لكل كلمة من النص مجموعة من المعلومات اللغوية الضرورية لكثير من التطبيقات.","clone_audio/moss-tts/ar/2023.acl-long.289_line018.wav","clone_audio/voxcpm2-tts/ar/2023.acl-long.289_line018.wav","reference_audio/2023.acl-long.289.wav"
293,29,"وأخيرا، يبدو أن تصنيف الموضوعات باللغة العربية يمثل مشكلة تتعلق بحجم مجموعة البيانات وتعقيدها، حيث أن مجموعة البيانات تزداد حجما وتصبح أقل تعقيدا، وتزداد الدقة بسرعة، وتزداد دقة المواضيع مع مجموعات البيانات الأكبر حجما بشكل ملحوظ، وتبين أيضا أن دقة المواضيع الأقل تعقيدا، التي تحتوي على مجموعة أقل تنوعا من المواضيع الفرعية، أعلى بكثير.","clone_audio/moss-tts/ar/2023.acl-long.293_line029.wav","clone_audio/voxcpm2-tts/ar/2023.acl-long.293_line029.wav","reference_audio/2023.acl-long.293.wav"
193,33,"ما يميز FlowX هو بنيتها المتقدمة القائمة على الرسوم البيانية، والتي تتيح للمستخدمين بناء تدفقات محادثة معقدة باستخدام أنواع خاصة من الوحدات عبر واجهة سحب وإفلات.","clone_audio/moss-tts/ar/2023.acl-long.193_line033.wav","clone_audio/voxcpm2-tts/ar/2023.acl-long.193_line033.wav","reference_audio/2023.acl-long.193.wav"
3,41,"لاحظنا أن الحلول الحالية تنقسم إلى فئتين رئيسيتين: أدوات البناء المرئية مثل Chatfuel وManyChat التي تركز على التدفقات المنظمة لكنها تفتقر إلى قدرات الذكاء الاصطناعي المتقدمة، ومنصات الذكاء الاصطناعي مثل Dialogflow التي تتطلب خبرة تقنية.","clone_audio/moss-tts/ar/2023.acl-long.3_line041.wav","clone_audio/voxcpm2-tts/ar/2023.acl-long.3_line041.wav","reference_audio/2023.acl-long.3.wav"
12,49,"تشمل تطبيقات معالجة اللغات أيضاً الترجمة الآلية (machine translation)، تأليف الكلام (speech synthesis)، التعرف على الكلام (speech recognition)، التشكيل الآلي (diacritization)، وغيرها.","clone_audio/moss-tts/ar/2023.acl-long.12_line049.wav","clone_audio/voxcpm2-tts/ar/2023.acl-long.12_line049.wav","reference_audio/2023.acl-long.12.wav"
